{
  "manifest_version": 1,
  "produced_by": "derived",
  "generator": "tools/span-derive.mjs",
  "locale": "ru",
  "source": {
    "path": "workbooks/en/typr-intro.srwb",
    "sha256": "b1c7e205ffa7ba7e665ea179a5312106688417709d8a56f98f13cf8521db98fc"
  },
  "target": {
    "path": "/tmp/claude-1000/-home-s243a-Projects-UnifyWeaver-examples-sci-repl-prototype/1e85ca50-6e86-4c69-99c6-e55aa4d662bb/scratchpad/jobs/typr-intro-ru/translated.srwb",
    "sha256": "cfb68db544e72eadf88cb60129fb7432bdd40cb8127fc02b82043868ad8a40fd"
  },
  "spans": [
    {
      "cell_index": 1,
      "cell_name": "basics",
      "source_span": {
        "start": {
          "line": 2,
          "col": 1
        },
        "end": {
          "line": 2,
          "col": 35
        },
        "text": "Variadic arguments are supported"
      },
      "target_span": {
        "start": {
          "line": 2,
          "col": 1
        },
        "end": {
          "line": 2,
          "col": 39
        },
        "text": "Поддерживаются вариативные аргументы"
      },
      "kind": "comment",
      "reaches_output": "none",
      "placeholders": []
    },
    {
      "cell_index": 2,
      "cell_name": "functions",
      "source_span": {
        "start": {
          "line": 1,
          "col": 1
        },
        "end": {
          "line": 1,
          "col": 33
        },
        "text": "Function bodies require braces"
      },
      "target_span": {
        "start": {
          "line": 1,
          "col": 1
        },
        "end": {
          "line": 1,
          "col": 39
        },
        "text": "Тела функций требуют фигурных скобок"
      },
      "kind": "comment",
      "reaches_output": "none",
      "placeholders": []
    },
    {
      "cell_index": 3,
      "cell_name": "typed",
      "source_span": {
        "start": {
          "line": 1,
          "col": 24
        },
        "end": {
          "line": 1,
          "col": 40
        },
        "text": "Hello from TypR!"
      },
      "target_span": {
        "start": {
          "line": 1,
          "col": 24
        },
        "end": {
          "line": 1,
          "col": 39
        },
        "text": "Привет от TypR!"
      },
      "kind": "display_string",
      "reaches_output": "stdout",
      "placeholders": []
    },
    {
      "cell_index": 4,
      "cell_name": "square",
      "source_span": {
        "start": {
          "line": 1,
          "col": 1
        },
        "end": {
          "line": 1,
          "col": 70
        },
        "text": "Explicit parameter and return types make calls statically checkable"
      },
      "target_span": {
        "start": {
          "line": 1,
          "col": 1
        },
        "end": {
          "line": 1,
          "col": 97
        },
        "text": "Явные типы параметров и возвращаемых значений позволяют выполнять статическую проверку вызовов"
      },
      "kind": "comment",
      "reaches_output": "none",
      "placeholders": []
    },
    {
      "cell_index": 4,
      "cell_name": "square",
      "source_span": {
        "start": {
          "line": 4,
          "col": 1
        },
        "end": {
          "line": 4,
          "col": 35
        },
        "text": "Variadic arguments work directly"
      },
      "target_span": {
        "start": {
          "line": 4,
          "col": 1
        },
        "end": {
          "line": 4,
          "col": 42
        },
        "text": "Вариативные аргументы работают напрямую"
      },
      "kind": "comment",
      "reaches_output": "none",
      "placeholders": []
    },
    {
      "cell_index": 4,
      "cell_name": "square",
      "source_span": {
        "start": {
          "line": 5,
          "col": 6
        },
        "end": {
          "line": 5,
          "col": 17
        },
        "text": "7 squared ="
      },
      "target_span": {
        "start": {
          "line": 5,
          "col": 6
        },
        "end": {
          "line": 5,
          "col": 20
        },
        "text": "7 в квадрате ="
      },
      "kind": "display_string",
      "reaches_output": "stdout",
      "placeholders": []
    },
    {
      "cell_index": 5,
      "cell_name": "variadic_forwarding",
      "source_span": {
        "start": {
          "line": 1,
          "col": 1
        },
        "end": {
          "line": 1,
          "col": 40
        },
        "text": "Forward heterogeneous named arguments"
      },
      "target_span": {
        "start": {
          "line": 1,
          "col": 1
        },
        "end": {
          "line": 1,
          "col": 47
        },
        "text": "Пересылка разнородных именованных аргументов"
      },
      "kind": "comment",
      "reaches_output": "none",
      "placeholders": []
    },
    {
      "cell_index": 5,
      "cell_name": "variadic_forwarding",
      "source_span": {
        "start": {
          "line": 6,
          "col": 15
        },
        "end": {
          "line": 6,
          "col": 21
        },
        "text": "Names:"
      },
      "target_span": {
        "start": {
          "line": 6,
          "col": 15
        },
        "end": {
          "line": 6,
          "col": 21
        },
        "text": "Имена:"
      },
      "kind": "display_string",
      "reaches_output": "stdout",
      "placeholders": []
    }
  ],
  "exclusions": []
}