{
  "manifest_version": 1,
  "produced_by": "derived",
  "generator": "tools/span-derive.mjs",
  "locale": "bn",
  "source": {
    "path": "workbooks/en/prolog-generates-clojurescript.srwb",
    "sha256": "dfb9c91b0e977c12d38e4090695fad62ce2c14178cee509b8bb8e0bcd3ff8dd6"
  },
  "target": {
    "path": "/tmp/claude-1000/-home-s243a-Projects-UnifyWeaver-examples-sci-repl-prototype/1e85ca50-6e86-4c69-99c6-e55aa4d662bb/scratchpad/jobs/prolog-generates-clojurescript-bn/translated.srwb",
    "sha256": "4b2bdf00e88d2faef9d80db2cc16ec88baa430086e7965b615fbaf819fa04a40"
  },
  "spans": [
    {
      "cell_index": 1,
      "cell_name": "load_compiler",
      "source_span": {
        "start": {
          "line": 1,
          "col": 1
        },
        "end": {
          "line": 1,
          "col": 36
        },
        "text": "Load UnifyWeaver compiler modules"
      },
      "target_span": {
        "start": {
          "line": 1,
          "col": 1
        },
        "end": {
          "line": 1,
          "col": 39
        },
        "text": "UnifyWeaver কম্পাইলার মডিউল লোড করুন"
      },
      "kind": "comment",
      "reaches_output": "none",
      "placeholders": []
    },
    {
      "cell_index": 2,
      "cell_name": "family_tree",
      "source_span": {
        "start": {
          "line": 1,
          "col": 1
        },
        "end": {
          "line": 1,
          "col": 39
        },
        "text": "Define a family tree as Prolog facts"
      },
      "target_span": {
        "start": {
          "line": 1,
          "col": 1
        },
        "end": {
          "line": 1,
          "col": 46
        },
        "text": "Prolog তথ্য হিসেবে বংশলতিকা সংজ্ঞায়িত করুন"
      },
      "kind": "comment",
      "reaches_output": "none",
      "placeholders": []
    },
    {
      "cell_index": 2,
      "cell_name": "family_tree",
      "source_span": {
        "start": {
          "line": 10,
          "col": 1
        },
        "end": {
          "line": 10,
          "col": 62
        },
        "text": "Transitive closure: ancestor(X, Y) if X is an ancestor of Y"
      },
      "target_span": {
        "start": {
          "line": 10,
          "col": 1
        },
        "end": {
          "line": 10,
          "col": 63
        },
        "text": "ট্রানজিটিভ ক্লোজার: ancestor(X, Y) যদি X, Y-এর পূর্বপুরুষ হয়"
      },
      "kind": "comment",
      "reaches_output": "none",
      "placeholders": []
    },
    {
      "cell_index": 3,
      "cell_name": "compile_to_clojurescript",
      "source_span": {
        "start": {
          "line": 1,
          "col": 1
        },
        "end": {
          "line": 1,
          "col": 55
        },
        "text": "Compile ancestor/2 to ClojureScript definitions only"
      },
      "target_span": {
        "start": {
          "line": 1,
          "col": 1
        },
        "end": {
          "line": 1,
          "col": 61
        },
        "text": "ancestor/2-কে শুধুমাত্র ClojureScript সংজ্ঞায় কম্পাইল করুন"
      },
      "kind": "comment",
      "reaches_output": "none",
      "placeholders": []
    },
    {
      "cell_index": 3,
      "cell_name": "compile_to_clojurescript",
      "source_span": {
        "start": {
          "line": 5,
          "col": 5
        },
        "end": {
          "line": 5,
          "col": 79
        },
        "text": "End with nil so generated seed expressions do not become notebook output"
      },
      "target_span": {
        "start": {
          "line": 5,
          "col": 5
        },
        "end": {
          "line": 5,
          "col": 76
        },
        "text": "nil দিয়ে শেষ করুন যাতে জেনারেট করা সিড এক্সপ্রেশন নোটবুক আউটপুট না হয়"
      },
      "kind": "comment",
      "reaches_output": "none",
      "placeholders": []
    },
    {
      "cell_index": 5,
      "cell_name": "cljs_output",
      "source_span": {
        "start": {
          "line": 1,
          "col": 1
        },
        "end": {
          "line": 1,
          "col": 48
        },
        "text": "; This cell will be populated by the compiler."
      },
      "target_span": {
        "start": {
          "line": 1,
          "col": 1
        },
        "end": {
          "line": 1,
          "col": 45
        },
        "text": ";; এই সেলটি কম্পাইলার দ্বারা পূর্ণ করা হবে।"
      },
      "kind": "comment",
      "reaches_output": "none",
      "placeholders": []
    },
    {
      "cell_index": 5,
      "cell_name": "cljs_output",
      "source_span": {
        "start": {
          "line": 2,
          "col": 1
        },
        "end": {
          "line": 2,
          "col": 56
        },
        "text": "; Run the 'compile_to_clojurescript' cell above first."
      },
      "target_span": {
        "start": {
          "line": 2,
          "col": 1
        },
        "end": {
          "line": 2,
          "col": 60
        },
        "text": ";; প্রথমে উপরের 'compile_to_clojurescript' সেলটি রান করুন।"
      },
      "kind": "comment",
      "reaches_output": "none",
      "placeholders": []
    },
    {
      "cell_index": 6,
      "cell_name": "cljs_queries",
      "source_span": {
        "start": {
          "line": 1,
          "col": 1
        },
        "end": {
          "line": 1,
          "col": 68
        },
        "text": "; Query the generated definitions in Scittle's persistent context."
      },
      "target_span": {
        "start": {
          "line": 1,
          "col": 1
        },
        "end": {
          "line": 1,
          "col": 68
        },
        "text": ";; Scittle-এর স্থায়ী কনটেক্সটে জেনারেট করা সংজ্ঞাগুলো কোয়েরি করুন।"
      },
      "kind": "comment",
      "reaches_output": "none",
      "placeholders": []
    },
    {
      "cell_index": 6,
      "cell_name": "cljs_queries",
      "source_span": {
        "start": {
          "line": 2,
          "col": 14
        },
        "end": {
          "line": 2,
          "col": 36
        },
        "text": "Descendants of alice: "
      },
      "target_span": {
        "start": {
          "line": 2,
          "col": 14
        },
        "end": {
          "line": 2,
          "col": 39
        },
        "text": "alice-এর উত্তরসূরীবৃন্দ: "
      },
      "kind": "display_string",
      "reaches_output": "stdout",
      "placeholders": []
    },
    {
      "cell_index": 6,
      "cell_name": "cljs_queries",
      "source_span": {
        "start": {
          "line": 3,
          "col": 14
        },
        "end": {
          "line": 3,
          "col": 40
        },
        "text": "alice is ancestor of eve: "
      },
      "target_span": {
        "start": {
          "line": 3,
          "col": 14
        },
        "end": {
          "line": 3,
          "col": 43
        },
        "text": "alice হলো eve-এর পূর্বপুরুষ: "
      },
      "kind": "display_string",
      "reaches_output": "stdout",
      "placeholders": []
    },
    {
      "cell_index": 6,
      "cell_name": "cljs_queries",
      "source_span": {
        "start": {
          "line": 4,
          "col": 14
        },
        "end": {
          "line": 4,
          "col": 42
        },
        "text": "alice is ancestor of frank: "
      },
      "target_span": {
        "start": {
          "line": 4,
          "col": 14
        },
        "end": {
          "line": 4,
          "col": 45
        },
        "text": "alice হলো frank-এর পূর্বপুরুষ: "
      },
      "kind": "display_string",
      "reaches_output": "stdout",
      "placeholders": []
    },
    {
      "cell_index": 8,
      "cell_name": "compile_to_clojure",
      "source_span": {
        "start": {
          "line": 1,
          "col": 1
        },
        "end": {
          "line": 1,
          "col": 74
        },
        "text": "Compile the same predicate to JVM Clojure for comparison (display only)"
      },
      "target_span": {
        "start": {
          "line": 1,
          "col": 1
        },
        "end": {
          "line": 1,
          "col": 83
        },
        "text": "তুলনার জন্য একই প্রেডিকেট JVM Clojure-এ কম্পাইল করুন (শুধুমাত্র প্রদর্শনের জন্য)"
      },
      "kind": "comment",
      "reaches_output": "none",
      "placeholders": []
    }
  ],
  "exclusions": []
}