{
  "manifest_version": 1,
  "produced_by": "derived",
  "generator": "tools/span-derive.mjs",
  "locale": "fr",
  "source": {
    "path": "workbooks/en/prolog-generates-clojurescript.srwb",
    "sha256": "dfb9c91b0e977c12d38e4090695fad62ce2c14178cee509b8bb8e0bcd3ff8dd6"
  },
  "target": {
    "path": "/tmp/claude-1000/-home-s243a-Projects-UnifyWeaver-examples-sci-repl-prototype/1e85ca50-6e86-4c69-99c6-e55aa4d662bb/scratchpad/jobs/prolog-generates-clojurescript-fr/translated.srwb",
    "sha256": "a44a59718da9ef1d55df3c614e9b2264f3fbb88f24cf7d8c01f33bc0dc6d6431"
  },
  "spans": [
    {
      "cell_index": 1,
      "cell_name": "load_compiler",
      "source_span": {
        "start": {
          "line": 1,
          "col": 1
        },
        "end": {
          "line": 1,
          "col": 36
        },
        "text": "Load UnifyWeaver compiler modules"
      },
      "target_span": {
        "start": {
          "line": 1,
          "col": 1
        },
        "end": {
          "line": 1,
          "col": 51
        },
        "text": "% Charger les modules du compilateur UnifyWeaver"
      },
      "kind": "comment",
      "reaches_output": "none",
      "placeholders": []
    },
    {
      "cell_index": 2,
      "cell_name": "family_tree",
      "source_span": {
        "start": {
          "line": 1,
          "col": 1
        },
        "end": {
          "line": 1,
          "col": 39
        },
        "text": "Define a family tree as Prolog facts"
      },
      "target_span": {
        "start": {
          "line": 1,
          "col": 1
        },
        "end": {
          "line": 1,
          "col": 61
        },
        "text": "% Définir un arbre généalogique sous forme de faits Prolog"
      },
      "kind": "comment",
      "reaches_output": "none",
      "placeholders": []
    },
    {
      "cell_index": 2,
      "cell_name": "family_tree",
      "source_span": {
        "start": {
          "line": 10,
          "col": 1
        },
        "end": {
          "line": 10,
          "col": 62
        },
        "text": "Transitive closure: ancestor(X, Y) if X is an ancestor of Y"
      },
      "target_span": {
        "start": {
          "line": 10,
          "col": 1
        },
        "end": {
          "line": 10,
          "col": 65
        },
        "text": "% Clôture transitive : ancestor(X, Y) si X est un ancêtre de Y"
      },
      "kind": "comment",
      "reaches_output": "none",
      "placeholders": []
    },
    {
      "cell_index": 3,
      "cell_name": "compile_to_clojurescript",
      "source_span": {
        "start": {
          "line": 1,
          "col": 1
        },
        "end": {
          "line": 1,
          "col": 55
        },
        "text": "Compile ancestor/2 to ClojureScript definitions only"
      },
      "target_span": {
        "start": {
          "line": 1,
          "col": 1
        },
        "end": {
          "line": 1,
          "col": 64
        },
        "text": "% Compiler ancestor/2 uniquement en définitions ClojureScript"
      },
      "kind": "comment",
      "reaches_output": "none",
      "placeholders": []
    },
    {
      "cell_index": 3,
      "cell_name": "compile_to_clojurescript",
      "source_span": {
        "start": {
          "line": 5,
          "col": 5
        },
        "end": {
          "line": 5,
          "col": 79
        },
        "text": "End with nil so generated seed expressions do not become notebook output"
      },
      "target_span": {
        "start": {
          "line": 5,
          "col": 5
        },
        "end": {
          "line": 5,
          "col": 108
        },
        "text": "% Terminer par nil pour que les expressions initiales générées ne deviennent pas une sortie de carnet"
      },
      "kind": "comment",
      "reaches_output": "none",
      "placeholders": []
    },
    {
      "cell_index": 6,
      "cell_name": "cljs_queries",
      "source_span": {
        "start": {
          "line": 1,
          "col": 1
        },
        "end": {
          "line": 1,
          "col": 68
        },
        "text": "; Query the generated definitions in Scittle's persistent context."
      },
      "target_span": {
        "start": {
          "line": 1,
          "col": 1
        },
        "end": {
          "line": 1,
          "col": 80
        },
        "text": ";; Interroger les définitions générées dans le contexte persistant de Scittle."
      },
      "kind": "comment",
      "reaches_output": "none",
      "placeholders": []
    },
    {
      "cell_index": 6,
      "cell_name": "cljs_queries",
      "source_span": {
        "start": {
          "line": 2,
          "col": 14
        },
        "end": {
          "line": 2,
          "col": 36
        },
        "text": "Descendants of alice: "
      },
      "target_span": {
        "start": {
          "line": 2,
          "col": 14
        },
        "end": {
          "line": 2,
          "col": 36
        },
        "text": "Descendants d'alice : "
      },
      "kind": "display_string",
      "reaches_output": "stdout",
      "placeholders": []
    },
    {
      "cell_index": 6,
      "cell_name": "cljs_queries",
      "source_span": {
        "start": {
          "line": 3,
          "col": 14
        },
        "end": {
          "line": 3,
          "col": 40
        },
        "text": "alice is ancestor of eve: "
      },
      "target_span": {
        "start": {
          "line": 3,
          "col": 14
        },
        "end": {
          "line": 3,
          "col": 40
        },
        "text": "alice est ancêtre d'eve : "
      },
      "kind": "display_string",
      "reaches_output": "stdout",
      "placeholders": []
    },
    {
      "cell_index": 6,
      "cell_name": "cljs_queries",
      "source_span": {
        "start": {
          "line": 4,
          "col": 14
        },
        "end": {
          "line": 4,
          "col": 42
        },
        "text": "alice is ancestor of frank: "
      },
      "target_span": {
        "start": {
          "line": 4,
          "col": 14
        },
        "end": {
          "line": 4,
          "col": 43
        },
        "text": "alice est ancêtre de frank : "
      },
      "kind": "display_string",
      "reaches_output": "stdout",
      "placeholders": []
    },
    {
      "cell_index": 8,
      "cell_name": "compile_to_clojure",
      "source_span": {
        "start": {
          "line": 1,
          "col": 1
        },
        "end": {
          "line": 1,
          "col": 74
        },
        "text": "Compile the same predicate to JVM Clojure for comparison (display only)"
      },
      "target_span": {
        "start": {
          "line": 1,
          "col": 1
        },
        "end": {
          "line": 1,
          "col": 90
        },
        "text": "% Compiler le même prédicat pour JVM Clojure à des fins de comparaison (affichage seul)"
      },
      "kind": "comment",
      "reaches_output": "none",
      "placeholders": []
    }
  ],
  "exclusions": []
}