{
  "manifest_version": 1,
  "produced_by": "derived",
  "generator": "tools/span-derive.mjs",
  "locale": "bn",
  "source": {
    "path": "workbooks/en/typr-intro.srwb",
    "sha256": "b1c7e205ffa7ba7e665ea179a5312106688417709d8a56f98f13cf8521db98fc"
  },
  "target": {
    "path": "/tmp/claude-1000/-home-s243a-Projects-UnifyWeaver-examples-sci-repl-prototype/1e85ca50-6e86-4c69-99c6-e55aa4d662bb/scratchpad/jobs/typr-intro-bn/translated.srwb",
    "sha256": "21e5148715897021c59f4bedc85a08586d6bc021532da629938974a677d78789"
  },
  "spans": [
    {
      "cell_index": 1,
      "cell_name": "basics",
      "source_span": {
        "start": {
          "line": 2,
          "col": 1
        },
        "end": {
          "line": 2,
          "col": 35
        },
        "text": "Variadic arguments are supported"
      },
      "target_span": {
        "start": {
          "line": 2,
          "col": 1
        },
        "end": {
          "line": 2,
          "col": 34
        },
        "text": "ভ্যারিয়াডিক আর্গুমেন্ট সমর্থিত"
      },
      "kind": "comment",
      "reaches_output": "none",
      "placeholders": []
    },
    {
      "cell_index": 2,
      "cell_name": "functions",
      "source_span": {
        "start": {
          "line": 1,
          "col": 1
        },
        "end": {
          "line": 1,
          "col": 33
        },
        "text": "Function bodies require braces"
      },
      "target_span": {
        "start": {
          "line": 1,
          "col": 1
        },
        "end": {
          "line": 1,
          "col": 39
        },
        "text": "ফাংশন বডিতে বন্ধনী (braces) প্রয়োজন"
      },
      "kind": "comment",
      "reaches_output": "none",
      "placeholders": []
    },
    {
      "cell_index": 3,
      "cell_name": "typed",
      "source_span": {
        "start": {
          "line": 1,
          "col": 24
        },
        "end": {
          "line": 1,
          "col": 40
        },
        "text": "Hello from TypR!"
      },
      "target_span": {
        "start": {
          "line": 1,
          "col": 24
        },
        "end": {
          "line": 1,
          "col": 41
        },
        "text": "TypR থেকে হ্যালো!"
      },
      "kind": "display_string",
      "reaches_output": "stdout",
      "placeholders": []
    },
    {
      "cell_index": 4,
      "cell_name": "square",
      "source_span": {
        "start": {
          "line": 1,
          "col": 1
        },
        "end": {
          "line": 1,
          "col": 70
        },
        "text": "Explicit parameter and return types make calls statically checkable"
      },
      "target_span": {
        "start": {
          "line": 1,
          "col": 1
        },
        "end": {
          "line": 1,
          "col": 83
        },
        "text": "স্পষ্ট প্যারামিটার এবং রিটার্ন টাইপ কলগুলোকে স্ট্যাটিকভাবে পরীক্ষাযোগ্য করে তোলে"
      },
      "kind": "comment",
      "reaches_output": "none",
      "placeholders": []
    },
    {
      "cell_index": 4,
      "cell_name": "square",
      "source_span": {
        "start": {
          "line": 4,
          "col": 1
        },
        "end": {
          "line": 4,
          "col": 35
        },
        "text": "Variadic arguments work directly"
      },
      "target_span": {
        "start": {
          "line": 4,
          "col": 1
        },
        "end": {
          "line": 4,
          "col": 41
        },
        "text": "ভ্যারিয়াডিক আর্গুমেন্ট সরাসরি কাজ করে"
      },
      "kind": "comment",
      "reaches_output": "none",
      "placeholders": []
    },
    {
      "cell_index": 4,
      "cell_name": "square",
      "source_span": {
        "start": {
          "line": 5,
          "col": 6
        },
        "end": {
          "line": 5,
          "col": 17
        },
        "text": "7 squared ="
      },
      "target_span": {
        "start": {
          "line": 5,
          "col": 6
        },
        "end": {
          "line": 5,
          "col": 17
        },
        "text": "7 এর বর্গ ="
      },
      "kind": "display_string",
      "reaches_output": "stdout",
      "placeholders": []
    },
    {
      "cell_index": 5,
      "cell_name": "variadic_forwarding",
      "source_span": {
        "start": {
          "line": 1,
          "col": 1
        },
        "end": {
          "line": 1,
          "col": 40
        },
        "text": "Forward heterogeneous named arguments"
      },
      "target_span": {
        "start": {
          "line": 1,
          "col": 1
        },
        "end": {
          "line": 1,
          "col": 48
        },
        "text": "ভিন্নধর্মী নামযুক্ত আর্গুমেন্ট ফরোয়ার্ড করুন"
      },
      "kind": "comment",
      "reaches_output": "none",
      "placeholders": []
    },
    {
      "cell_index": 5,
      "cell_name": "variadic_forwarding",
      "source_span": {
        "start": {
          "line": 6,
          "col": 15
        },
        "end": {
          "line": 6,
          "col": 21
        },
        "text": "Names:"
      },
      "target_span": {
        "start": {
          "line": 6,
          "col": 15
        },
        "end": {
          "line": 6,
          "col": 23
        },
        "text": "নামসমূহ:"
      },
      "kind": "display_string",
      "reaches_output": "stdout",
      "placeholders": []
    }
  ],
  "exclusions": []
}