{
  "manifest_version": 1,
  "produced_by": "derived",
  "generator": "tools/span-derive.mjs",
  "locale": "hi",
  "source": {
    "path": "workbooks/en/typr-intro.srwb",
    "sha256": "b1c7e205ffa7ba7e665ea179a5312106688417709d8a56f98f13cf8521db98fc"
  },
  "target": {
    "path": "/tmp/claude-1000/-home-s243a-Projects-UnifyWeaver-examples-sci-repl-prototype/1e85ca50-6e86-4c69-99c6-e55aa4d662bb/scratchpad/jobs/typr-intro-hi/translated.srwb",
    "sha256": "bb8e86ba66ed6ab4ad2822ba60d5bfcb960a857b8898d5d98afbfebe87022bda"
  },
  "spans": [
    {
      "cell_index": 1,
      "cell_name": "basics",
      "source_span": {
        "start": {
          "line": 2,
          "col": 1
        },
        "end": {
          "line": 2,
          "col": 35
        },
        "text": "Variadic arguments are supported"
      },
      "target_span": {
        "start": {
          "line": 2,
          "col": 1
        },
        "end": {
          "line": 2,
          "col": 52
        },
        "text": "वैरिएडिक तर्कों (variadic arguments) का समर्थन है"
      },
      "kind": "comment",
      "reaches_output": "none",
      "placeholders": []
    },
    {
      "cell_index": 2,
      "cell_name": "functions",
      "source_span": {
        "start": {
          "line": 1,
          "col": 1
        },
        "end": {
          "line": 1,
          "col": 33
        },
        "text": "Function bodies require braces"
      },
      "target_span": {
        "start": {
          "line": 1,
          "col": 1
        },
        "end": {
          "line": 1,
          "col": 42
        },
        "text": "फ़ंक्शन बॉडी के लिए ब्रेसिज़ आवश्यक हैं"
      },
      "kind": "comment",
      "reaches_output": "none",
      "placeholders": []
    },
    {
      "cell_index": 3,
      "cell_name": "typed",
      "source_span": {
        "start": {
          "line": 1,
          "col": 24
        },
        "end": {
          "line": 1,
          "col": 40
        },
        "text": "Hello from TypR!"
      },
      "target_span": {
        "start": {
          "line": 1,
          "col": 24
        },
        "end": {
          "line": 1,
          "col": 45
        },
        "text": "TypR की ओर से नमस्ते!"
      },
      "kind": "display_string",
      "reaches_output": "stdout",
      "placeholders": []
    },
    {
      "cell_index": 4,
      "cell_name": "square",
      "source_span": {
        "start": {
          "line": 1,
          "col": 1
        },
        "end": {
          "line": 1,
          "col": 70
        },
        "text": "Explicit parameter and return types make calls statically checkable"
      },
      "target_span": {
        "start": {
          "line": 1,
          "col": 1
        },
        "end": {
          "line": 1,
          "col": 80
        },
        "text": "स्पष्ट पैरामीटर और रिटर्न प्रकार कॉल्स को स्थिर रूप से जांचने योग्य बनाते हैं"
      },
      "kind": "comment",
      "reaches_output": "none",
      "placeholders": []
    },
    {
      "cell_index": 4,
      "cell_name": "square",
      "source_span": {
        "start": {
          "line": 4,
          "col": 1
        },
        "end": {
          "line": 4,
          "col": 35
        },
        "text": "Variadic arguments work directly"
      },
      "target_span": {
        "start": {
          "line": 4,
          "col": 1
        },
        "end": {
          "line": 4,
          "col": 34
        },
        "text": "वैरिएडिक तर्क सीधे काम करते हैं"
      },
      "kind": "comment",
      "reaches_output": "none",
      "placeholders": []
    },
    {
      "cell_index": 4,
      "cell_name": "square",
      "source_span": {
        "start": {
          "line": 5,
          "col": 6
        },
        "end": {
          "line": 5,
          "col": 17
        },
        "text": "7 squared ="
      },
      "target_span": {
        "start": {
          "line": 5,
          "col": 6
        },
        "end": {
          "line": 5,
          "col": 17
        },
        "text": "7 का वर्ग ="
      },
      "kind": "display_string",
      "reaches_output": "stdout",
      "placeholders": []
    },
    {
      "cell_index": 5,
      "cell_name": "variadic_forwarding",
      "source_span": {
        "start": {
          "line": 1,
          "col": 1
        },
        "end": {
          "line": 1,
          "col": 40
        },
        "text": "Forward heterogeneous named arguments"
      },
      "target_span": {
        "start": {
          "line": 1,
          "col": 1
        },
        "end": {
          "line": 1,
          "col": 69
        },
        "text": "विषम नामित तर्कों (heterogeneous named arguments) को अग्रेषित करें"
      },
      "kind": "comment",
      "reaches_output": "none",
      "placeholders": []
    },
    {
      "cell_index": 5,
      "cell_name": "variadic_forwarding",
      "source_span": {
        "start": {
          "line": 6,
          "col": 15
        },
        "end": {
          "line": 6,
          "col": 21
        },
        "text": "Names:"
      },
      "target_span": {
        "start": {
          "line": 6,
          "col": 15
        },
        "end": {
          "line": 6,
          "col": 19
        },
        "text": "नाम:"
      },
      "kind": "display_string",
      "reaches_output": "stdout",
      "placeholders": []
    }
  ],
  "exclusions": []
}