{
  "manifest_version": 1,
  "produced_by": "derived",
  "generator": "tools/span-derive.mjs",
  "locale": "ko",
  "source": {
    "path": "workbooks/en/prolog-generates-clojurescript.srwb",
    "sha256": "dfb9c91b0e977c12d38e4090695fad62ce2c14178cee509b8bb8e0bcd3ff8dd6"
  },
  "target": {
    "path": "/tmp/claude-1000/-home-s243a-Projects-UnifyWeaver-examples-sci-repl-prototype/1e85ca50-6e86-4c69-99c6-e55aa4d662bb/scratchpad/jobs/prolog-generates-clojurescript-ko/translated.srwb",
    "sha256": "15d368e83d4e647c5d50e194bcea9562b6d770537cfe9ec29ba61e607e620410"
  },
  "spans": [
    {
      "cell_index": 1,
      "cell_name": "load_compiler",
      "source_span": {
        "start": {
          "line": 1,
          "col": 1
        },
        "end": {
          "line": 1,
          "col": 36
        },
        "text": "Load UnifyWeaver compiler modules"
      },
      "target_span": {
        "start": {
          "line": 1,
          "col": 1
        },
        "end": {
          "line": 1,
          "col": 25
        },
        "text": "UnifyWeaver 컴파일러 모듈 로드"
      },
      "kind": "comment",
      "reaches_output": "none",
      "placeholders": []
    },
    {
      "cell_index": 2,
      "cell_name": "family_tree",
      "source_span": {
        "start": {
          "line": 1,
          "col": 1
        },
        "end": {
          "line": 1,
          "col": 39
        },
        "text": "Define a family tree as Prolog facts"
      },
      "target_span": {
        "start": {
          "line": 1,
          "col": 1
        },
        "end": {
          "line": 1,
          "col": 21
        },
        "text": "가계도를 Prolog 사실로 정의"
      },
      "kind": "comment",
      "reaches_output": "none",
      "placeholders": []
    },
    {
      "cell_index": 2,
      "cell_name": "family_tree",
      "source_span": {
        "start": {
          "line": 10,
          "col": 1
        },
        "end": {
          "line": 10,
          "col": 62
        },
        "text": "Transitive closure: ancestor(X, Y) if X is an ancestor of Y"
      },
      "target_span": {
        "start": {
          "line": 10,
          "col": 1
        },
        "end": {
          "line": 10,
          "col": 35
        },
        "text": "이행 폐포: X가 Y의 조상이면 ancestor(X, Y)"
      },
      "kind": "comment",
      "reaches_output": "none",
      "placeholders": []
    },
    {
      "cell_index": 3,
      "cell_name": "compile_to_clojurescript",
      "source_span": {
        "start": {
          "line": 1,
          "col": 1
        },
        "end": {
          "line": 1,
          "col": 55
        },
        "text": "Compile ancestor/2 to ClojureScript definitions only"
      },
      "target_span": {
        "start": {
          "line": 1,
          "col": 1
        },
        "end": {
          "line": 1,
          "col": 37
        },
        "text": "ancestor/2를 ClojureScript 정의로만 컴파일"
      },
      "kind": "comment",
      "reaches_output": "none",
      "placeholders": []
    },
    {
      "cell_index": 3,
      "cell_name": "compile_to_clojurescript",
      "source_span": {
        "start": {
          "line": 5,
          "col": 5
        },
        "end": {
          "line": 5,
          "col": 79
        },
        "text": "End with nil so generated seed expressions do not become notebook output"
      },
      "target_span": {
        "start": {
          "line": 5,
          "col": 5
        },
        "end": {
          "line": 5,
          "col": 41
        },
        "text": "생성된 시드 표현식이 노트북 출력이 되지 않도록 nil로 종료"
      },
      "kind": "comment",
      "reaches_output": "none",
      "placeholders": []
    },
    {
      "cell_index": 5,
      "cell_name": "cljs_output",
      "source_span": {
        "start": {
          "line": 1,
          "col": 1
        },
        "end": {
          "line": 1,
          "col": 48
        },
        "text": "; This cell will be populated by the compiler."
      },
      "target_span": {
        "start": {
          "line": 1,
          "col": 1
        },
        "end": {
          "line": 1,
          "col": 24
        },
        "text": "; 이 셀은 컴파일러에 의해 채워집니다."
      },
      "kind": "comment",
      "reaches_output": "none",
      "placeholders": []
    },
    {
      "cell_index": 5,
      "cell_name": "cljs_output",
      "source_span": {
        "start": {
          "line": 2,
          "col": 1
        },
        "end": {
          "line": 2,
          "col": 56
        },
        "text": "; Run the 'compile_to_clojurescript' cell above first."
      },
      "target_span": {
        "start": {
          "line": 2,
          "col": 1
        },
        "end": {
          "line": 2,
          "col": 46
        },
        "text": "; 위의 'compile_to_clojurescript' 셀을 먼저 실행하세요."
      },
      "kind": "comment",
      "reaches_output": "none",
      "placeholders": []
    },
    {
      "cell_index": 6,
      "cell_name": "cljs_queries",
      "source_span": {
        "start": {
          "line": 1,
          "col": 1
        },
        "end": {
          "line": 1,
          "col": 68
        },
        "text": "; Query the generated definitions in Scittle's persistent context."
      },
      "target_span": {
        "start": {
          "line": 1,
          "col": 1
        },
        "end": {
          "line": 1,
          "col": 37
        },
        "text": "; Scittle의 영구 컨텍스트에서 생성된 정의를 쿼리합니다."
      },
      "kind": "comment",
      "reaches_output": "none",
      "placeholders": []
    },
    {
      "cell_index": 6,
      "cell_name": "cljs_queries",
      "source_span": {
        "start": {
          "line": 2,
          "col": 14
        },
        "end": {
          "line": 2,
          "col": 36
        },
        "text": "Descendants of alice: "
      },
      "target_span": {
        "start": {
          "line": 2,
          "col": 14
        },
        "end": {
          "line": 2,
          "col": 25
        },
        "text": "alice의 후손: "
      },
      "kind": "display_string",
      "reaches_output": "stdout",
      "placeholders": []
    },
    {
      "cell_index": 6,
      "cell_name": "cljs_queries",
      "source_span": {
        "start": {
          "line": 3,
          "col": 14
        },
        "end": {
          "line": 3,
          "col": 40
        },
        "text": "alice is ancestor of eve: "
      },
      "target_span": {
        "start": {
          "line": 3,
          "col": 14
        },
        "end": {
          "line": 3,
          "col": 30
        },
        "text": "alice는 eve의 조상: "
      },
      "kind": "display_string",
      "reaches_output": "stdout",
      "placeholders": []
    },
    {
      "cell_index": 6,
      "cell_name": "cljs_queries",
      "source_span": {
        "start": {
          "line": 4,
          "col": 14
        },
        "end": {
          "line": 4,
          "col": 42
        },
        "text": "alice is ancestor of frank: "
      },
      "target_span": {
        "start": {
          "line": 4,
          "col": 14
        },
        "end": {
          "line": 4,
          "col": 32
        },
        "text": "alice는 frank의 조상: "
      },
      "kind": "display_string",
      "reaches_output": "stdout",
      "placeholders": []
    },
    {
      "cell_index": 8,
      "cell_name": "compile_to_clojure",
      "source_span": {
        "start": {
          "line": 1,
          "col": 1
        },
        "end": {
          "line": 1,
          "col": 74
        },
        "text": "Compile the same predicate to JVM Clojure for comparison (display only)"
      },
      "target_span": {
        "start": {
          "line": 1,
          "col": 1
        },
        "end": {
          "line": 1,
          "col": 43
        },
        "text": "비교를 위해 동일한 서술어를 JVM Clojure로 컴파일 (표시 전용)"
      },
      "kind": "comment",
      "reaches_output": "none",
      "placeholders": []
    }
  ],
  "exclusions": []
}