{
  "manifest_version": 1,
  "produced_by": "derived",
  "generator": "tools/span-derive.mjs",
  "locale": "fr",
  "source": {
    "path": "workbooks/en/typr-intro.srwb",
    "sha256": "b1c7e205ffa7ba7e665ea179a5312106688417709d8a56f98f13cf8521db98fc"
  },
  "target": {
    "path": "/tmp/claude-1000/-home-s243a-Projects-UnifyWeaver-examples-sci-repl-prototype/1e85ca50-6e86-4c69-99c6-e55aa4d662bb/scratchpad/jobs/typr-intro-fr/translated.srwb",
    "sha256": "af4c9931727528d49eb1ef3b7fdd4d12c934399217743e17465608792f8434f4"
  },
  "spans": [
    {
      "cell_index": 1,
      "cell_name": "basics",
      "source_span": {
        "start": {
          "line": 2,
          "col": 1
        },
        "end": {
          "line": 2,
          "col": 35
        },
        "text": "Variadic arguments are supported"
      },
      "target_span": {
        "start": {
          "line": 2,
          "col": 1
        },
        "end": {
          "line": 2,
          "col": 48
        },
        "text": "Les arguments variadiques sont pris en charge"
      },
      "kind": "comment",
      "reaches_output": "none",
      "placeholders": []
    },
    {
      "cell_index": 2,
      "cell_name": "functions",
      "source_span": {
        "start": {
          "line": 1,
          "col": 1
        },
        "end": {
          "line": 1,
          "col": 33
        },
        "text": "Function bodies require braces"
      },
      "target_span": {
        "start": {
          "line": 1,
          "col": 1
        },
        "end": {
          "line": 1,
          "col": 49
        },
        "text": "Le corps des fonctions nécessite des accolades"
      },
      "kind": "comment",
      "reaches_output": "none",
      "placeholders": []
    },
    {
      "cell_index": 3,
      "cell_name": "typed",
      "source_span": {
        "start": {
          "line": 1,
          "col": 24
        },
        "end": {
          "line": 1,
          "col": 40
        },
        "text": "Hello from TypR!"
      },
      "target_span": {
        "start": {
          "line": 1,
          "col": 24
        },
        "end": {
          "line": 1,
          "col": 41
        },
        "text": "Bonjour de TypR !"
      },
      "kind": "display_string",
      "reaches_output": "stdout",
      "placeholders": []
    },
    {
      "cell_index": 4,
      "cell_name": "square",
      "source_span": {
        "start": {
          "line": 1,
          "col": 1
        },
        "end": {
          "line": 1,
          "col": 70
        },
        "text": "Explicit parameter and return types make calls statically checkable"
      },
      "target_span": {
        "start": {
          "line": 1,
          "col": 1
        },
        "end": {
          "line": 1,
          "col": 94
        },
        "text": "Les types explicites de paramètres et de retour rendent les appels vérifiables statiquement"
      },
      "kind": "comment",
      "reaches_output": "none",
      "placeholders": []
    },
    {
      "cell_index": 4,
      "cell_name": "square",
      "source_span": {
        "start": {
          "line": 4,
          "col": 1
        },
        "end": {
          "line": 4,
          "col": 35
        },
        "text": "Variadic arguments work directly"
      },
      "target_span": {
        "start": {
          "line": 4,
          "col": 1
        },
        "end": {
          "line": 4,
          "col": 53
        },
        "text": "Les arguments variadiques fonctionnent directement"
      },
      "kind": "comment",
      "reaches_output": "none",
      "placeholders": []
    },
    {
      "cell_index": 4,
      "cell_name": "square",
      "source_span": {
        "start": {
          "line": 5,
          "col": 6
        },
        "end": {
          "line": 5,
          "col": 17
        },
        "text": "7 squared ="
      },
      "target_span": {
        "start": {
          "line": 5,
          "col": 6
        },
        "end": {
          "line": 5,
          "col": 18
        },
        "text": "7 au carré ="
      },
      "kind": "display_string",
      "reaches_output": "stdout",
      "placeholders": []
    },
    {
      "cell_index": 5,
      "cell_name": "variadic_forwarding",
      "source_span": {
        "start": {
          "line": 1,
          "col": 1
        },
        "end": {
          "line": 1,
          "col": 40
        },
        "text": "Forward heterogeneous named arguments"
      },
      "target_span": {
        "start": {
          "line": 1,
          "col": 1
        },
        "end": {
          "line": 1,
          "col": 46
        },
        "text": "Transférer des arguments nommés hétérogènes"
      },
      "kind": "comment",
      "reaches_output": "none",
      "placeholders": []
    },
    {
      "cell_index": 5,
      "cell_name": "variadic_forwarding",
      "source_span": {
        "start": {
          "line": 6,
          "col": 15
        },
        "end": {
          "line": 6,
          "col": 21
        },
        "text": "Names:"
      },
      "target_span": {
        "start": {
          "line": 6,
          "col": 15
        },
        "end": {
          "line": 6,
          "col": 21
        },
        "text": "Noms :"
      },
      "kind": "display_string",
      "reaches_output": "stdout",
      "placeholders": []
    }
  ],
  "exclusions": []
}